{
  "colloq_session": "0.1.0",
  "conversation": "example.generate",
  "conversation_identity": "sha256:92c198d0118d5fe0e4d44e653b9d82ce9e2a3a06883bf51cd3d876d726e2af00",
  "plan_identity": "sha256:016d59757bf6895e8c65dfe2c88e5a2c724d808ddfceb20f5066c6fb8c62f72a",
  "role": "client",
  "wire": "compact"
}
